<?xml version="1.0" encoding="UTF-8"?>
<!DOCTYPE page SYSTEM "..\Data\PAWSSKHtmlMapper.dtd" [
<!ENTITY TechnicalTerms SYSTEM  "TechnicalTerms.xml">
]>
<?xml-stylesheet type="text/xsl" href="..\Transforms\PAWSSKHtmlMapper.xsl"?>
<page id="PronNP" count="7/9">
	<title level="2">Pronouns - As a Nominal Phrase</title>
   <introduction>Pronouns of all types normally stand alone in the place of an entire nominal phrase, but they can also be modified by a relative clause. In some languages pronouns may be modified by partitive phrases, and other languages allow pronouns to also be modified by <technicalTermRef term="ttDeterminers"/> and wide scope quantifiers and degree words. English examples of this type include the following:</introduction>
		<EnglishExample>
			<exItem label="1.">just we three</exItem>
			<exItem label="2.">only he</exItem>
		   <exItem label="3.">only these</exItem>
		</EnglishExample>
   <introduction>In fewer languages, pronouns can also be modified by adjectives and possessors, acting just like nouns.</introduction>
   <form section="pron">
      <radioGroup>
         <groupName dataItem="pronMod" default="no">RPronMod</groupName>
         <prompt><br/>Can pronouns be modified in your language?</prompt>
         <radio id="PronModNo" dataValue="no">No, these elements only appear by themselves when they take the place of a nominal phrase.  Not even relative clauses are allowed as modifiers </radio>
         <radio id="PronModRel" dataValue="rel">Only relative clauses are possible</radio>
         <radio id="PronModPart" dataValue="part">Only relative clauses and partitive phrases are allowed</radio>
         <radio id="PronModDet" dataValue="det">Yes, these elements can be modified by the wide scope quantifiers and degree words <span id="PronModDetArtSpan"  show="swArt">and articles</span><span id="PronModDetDemSpan" show="swDem">and demonstratives</span ><span id="PronModArtDemSpan" show="swArtAndDem">and articles and demonstratives</span> in addition to relative clauses and partitive phrases</radio>
     <radio id="PronModAll" dataValue="all">Yes, these elements can be modified by all the same modifiers as nouns can, including adjectives and possessors</radio>
      </radioGroup>   
      <prompt id="PronModMinimalExamplePrompt" show="swPronModDetOrAll">Key examples from your language of pronouns modified by some or all of the allowed elements here:</prompt>
		<textBox id="PronNPStandAloneExample" dataItem="standAloneNPExample" show="swPronModDetOrAll"/>
      <prompt id="PronModSentExamplePrompt" show="swPronModDetOrAll">Now take several of the examples you keyed in the textbox above and use them as the subject or object of a sentence here:</prompt>
      
      <br/><br/>
      <introduction>In addition, pronouns can usually be modified by a partitive phrase (or other PP), as in:</introduction>
      <EnglishExample>
         <exItem label="4.">you in there</exItem>
         <exItem label="5.">we of this state</exItem>
         <exItem label="6.">those of you from that school</exItem>
      </EnglishExample>
      <br/>
      <prompt id="PronNPPartitiveModNo" show="swPronModNoOrRel">We assume this is not possible in your language, based on your answer above.  If this is incorrect, please change your answer above.</prompt>
      <prompt id="PronNPPartitiveMod" show="swPronModNotNoOrRel">Key your examples here:</prompt>
      <textBox id="PronNPPartitiveExample" dataItem="partitiveExample" show="swPronModNotNoOrRel"/>
      <br/>
      <radioGroup id="PronNPPartitiveTable" show="swPronModNotNoOrRel">
         <groupName dataItem="partitivePos" default="unknown" position="yesHeadDiff">RPronNPPartitive</groupName>
         <prompt>Where does the optional PP occur with respect to the pronoun?</prompt>
         <radio id="PronNPPartBefore" dataValue="before">Before</radio>
         <radio id="PronNPPartAfter" dataValue="after">After</radio>
         <radio id="PronNPPartEither" dataValue="either">On either side</radio>
      </radioGroup>
      <br/><br/>
      <introduction>Finally, it is usually possible to have a pronoun modified by a relative clause, as in:</introduction>
		<EnglishExample>
			<exItem label="7.">you who are going with us</exItem>
		   <exItem label="8.">everyone who wants to come</exItem>
		   <exItem label="9.">we who believe</exItem>
		</EnglishExample>
		<br/>
      <prompt id="PronNPRelModNo" show="swPronModNo">We assume this is not possible in your language, based on your answer above.  If this is incorrect, please change your answer above.</prompt>
      <prompt id="PronNPRelClMod" show="swPronModNotNo">Key your examples with relative clauses, placing these nominal phrases as the subject or object of a simple sentence, here:</prompt>
		<textBox id="PronNPRelCl" dataItem="pronRelClExample" show="swPronModNotNo"/>
		<br/>
      <instruction id="PronDistributionNPInstruction" show="swNotPracticalAndPronModDet">In the tree structure given at the beginning of <section number="5">Nominal Phrases</section>, we will assume for your language that pronouns can fill the NP position, because they can be modified by degree words, demonstratives, articles, relative clauses and PPs, but not by possessors or adjectives.</instruction>
      <instruction id="PronDistributionNPPartInstruction" show="swNotPracticalAndPronModPart">In the tree structure given at the beginning of <section number="5">Nominal Phrases</section>, we will assume for your language that pronouns can fill the NP position, because they can be modified by relative clauses and PPs.</instruction>
      <instruction id="PronDistributionNInstruction" show="swNotPracticalAndPronModAll">In the tree structure given at the beginning of <section number="5">Simple and Possessed Nominal Phrases</section>, we will assume for your language that pronouns can fill the N position, because they can be modified by all the same categories as nouns can.</instruction>
      <instruction id="PronDistributionDPInstruction" show="swNotPracticalAndPronModNoOrRel">In the tree structure given at the beginning of <section number="5">Simple and Possessed Nominal Phrases</section>, we will assume for your language that pronouns can fill the DP position, because they must stand alone in the place of a whole nominal phrase, or possibly be modified by a relative clause.</instruction>  
		<br/><br/>
		<buttons>
			<button id="PronNPBack" value="Back" goto="PronIndefinite.xml"/>
		    <button id="PronNPNext" value="Next" goto="PronCatMap.xml" gotoNoGrammar="Contents.htm"/>
		</buttons>
	</form>
	<showWhen id="swNotPractical">
		<whenValue  element="paws" attr="outputGrammar" value="True"/>
	</showWhen>
   <showWhen id="swArt">
      <whenValue element="np" attr="artAndDem" value="article"/>
   </showWhen>
   <showWhen id="swDem">
      <whenValue element="np" attr="artAndDem" value="demonstrative"/>
   </showWhen>
   <showWhen id="swArtAndDem">
      <whenValue element="np" attr="artAndDem" value="both"/>
   </showWhen>
   <showWhen id="swPronModNotNo">
      <not/><whenRadio button="PronModNo"/>
   </showWhen>
   <showWhen id="swPronModNo">
      <whenRadio button="PronModNo"/>
   </showWhen>
   <showWhen id="swNotPracticalAndPronModDet">
      <whenValue  element="paws" attr="outputGrammar" value="True"/>
      <and/>
      <whenRadio button="PronModDet"/>
   </showWhen> 
   <showWhen id="swNotPracticalAndPronModAll">
      <whenValue  element="paws" attr="outputGrammar" value="True"/>
      <and/>
      <whenRadio button="PronModAll"/>
   </showWhen> 
   <showWhen id="swNotPracticalAndPronModNo">
      <whenValue  element="paws" attr="outputGrammar" value="True"/>
      <and/>
      <whenRadio button="PronModNo"/>
   </showWhen> 
   <showWhen id="swNotPracticalAndPronModPart">
      <whenValue  element="paws" attr="outputGrammar" value="True"/>
      <and/>
      <whenRadio button="PronModPart"/>
   </showWhen>
   <showWhen id="swNotPracticalAndPronModNoOrRel">
      <whenValue  element="paws" attr="outputGrammar" value="True"/>
      <and/>
      <whenRadio button="PronModNo"/>
      <or/>
      <whenValue  element="paws" attr="outputGrammar" value="True"/>
      <and/>
      <whenRadio button="PronModRel"/>
   </showWhen>
<showWhen id="swPronModNoOrRel">
   <whenRadio button="PronModNo"/>
   <or/>
   <whenRadio button="PronModRel"/>
   </showWhen>
   <showWhen id="swPronModNotNoOrRel">
      <not/><whenRadio button="PronModNo"/>
      <and/><not/>
      <whenRadio button="PronModRel"/>
   </showWhen>
   <showWhen id="swPronModDetOrAll">
      <whenRadio button="PronModDet"/>
      <or/>
      <whenRadio button="PronModAll"/>
   </showWhen>
   
   &TechnicalTerms; 
   
</page>
