<?xml version="1.0" encoding="UTF-8"?>
<!DOCTYPE page SYSTEM "..\Data\PAWSSKHtmlMapper.dtd">
<?xml-stylesheet type="text/xsl" href="..\Transforms\PAWSSKHtmlMapper.xsl"?>
<page id="LangProp">
	<title level="2">Language Properties</title>
	<introduction>The PAWS Starter Kit is for a particular language.  Certain
information is needed.  Please enter the appropriate information
below.</introduction>
	<form section="language">
		<prompt>Enter the name of your language:</prompt>
		<textBox id="LangPropLangName" dataItem="langName" cols="50" rows="1"/>
		<prompt>Enter an abbreviation for your language (we suggest using the Ethnologue or ISO639-3 code):</prompt>
		<textBox id="LangPropLangAbbr" dataItem="langAbbr" cols="4" rows="1"/>
		<font id="LangPropFont" dataItem="font">
		<prompt>The name of the font that will be used to display your language data is shown below.  Click on the 'Change font' button to change it.</prompt></font>
		<radioGroup>
			<groupName dataItem="rtl" default="False">RLangPropRTL</groupName>
			<prompt>In what direction is your language written?</prompt>
			<radio id="LangPropRTLLTR" dataValue="False">Left to right</radio>
			<radio id="LangPropRTLRTL" dataValue="True">Right to left</radio>
		</radioGroup>
		<buttons>
			<button id="LangPropBack" value="Back" goto="LeftOffAt.htm"/>
			<button id="LangPropNext" value="Next" goto="LeftOffAt.htm"/>
		</buttons>
	</form>
</page>
